No,Title,Author,Journal,Vol,No,Pages,Published_Year
2989,解析信号を用いたクラックルの特徴分析,"天野 有二, 鈴木 彰文",生体医工学,Annual56,Abstract,S275,2018
2990,呼吸性不整脈位相カップリングと徐波睡眠の連関,"新関 久一, 鵜川 成美, 齊藤 直",生体医工学,Annual56,Abstract,S274,2018
2991,感染症スクリーニングのためのCCDカメラとサーモグラフィを併用した非接触かつ高精度バイタルサイン計測,"根岸 寿明, 孫 光鎬, 桐本 哲郎, 佐藤 正平, 松井 岳巳",生体医工学,Annual56,Abstract,S273,2018
2992,小型レーダーを用いた非接触計測による高齢者の超早期肺炎スクリーニング法の開発と臨床応用,"平野 雅也, 松尾 太郎, 中村 凜, 渡辺 貞雄, 橋爪 絢子, 孫 光鎬, 廣田 宗司, 中村 大輔, 箱崎 幸也, 松井 岳巳",生体医工学,Annual56,Abstract,S272,2018
2993,非接触COPD(慢性閉塞性肺疾患)スクリーニングシステムの開発,"高本 裕紀, 孫 光鎬, 佐藤 正平, 西根 広樹, 松井 岳巳, 峯下 昌道",生体医工学,Annual56,Abstract,S271,2018
2994,少数方向撮影による胸部トモシンセシスの可能性,"堀 拳輔, 董 居忠, 岡本 啓公, 関 将志, 村石 浩, 齊藤 典生, ティティ ルイン, 原 秀剛, 渡辺 宝, 橋本 雄幸, 王 波, 武田 徹",生体医工学,Annual56,Abstract,S270,2018
2995,福島県における医療機器開発支援ネットワーク,田中 明,生体医工学,Annual56,Abstract,S27-2,2018
2996,東北大学の非臨床ME,"白石 泰之, 山家 智之",生体医工学,Annual56,Abstract,S27-1,2018
2997,中赤外光を用いた非侵襲血糖値センシング　－ヘルスケア機器の開発に向けて－,"松浦 祐司, 吉岡 希利子, 木野 彩子",生体医工学,Annual56,Abstract,S269,2018
2998,KTN光プローブを用いた硬性内視鏡型OCTの開発,近江 雅人,生体医工学,Annual56,Abstract,S268,2018
2999,非線形ラマン散乱硬性鏡を用いた神経イメージング,橋本 守,生体医工学,Annual56,Abstract,S267,2018
3000,ラマン分光法・非線形光学による術中がんイメージング技術の開発,"大嶋 佑介, 古賀 繁宏, 渡部 祐司",生体医工学,Annual56,Abstract,S266,2018
3001,光音響イメージングの探索的臨床研究の紹介,石原 美弥,生体医工学,Annual56,Abstract,S265,2018
3002,樹状細胞の伸展状態がソノポレーションによる膜損傷の発生率に与える影響,"松本 龍之介, 工藤 信樹",生体医工学,Annual56,Abstract,S264,2018
3003,細胞に対する単発撃力刺激負荷のための磁気によるカンチレバー制御,"柳生 右京, 中川 桂一, 加藤 拓真, 塚本 哲, 佐久間 一郎, 小林 英津子",生体医工学,Annual56,Abstract,S263,2018
3004,細胞担持マイクロファイバーの集積によるチューブ状組織構造体の高速作製,"岩永 進太郎, 中村 真人",生体医工学,Annual56,Abstract,S262,2018
3005,生体高分子線維形状シミュレーションによるエントロピー弾性の検討,"伊藤 俊幸, 馮 忠剛, 小沢田 正, 佐藤 大介, 中村 孝夫",生体医工学,Annual56,Abstract,S261,2018
3006,高静水圧処理による組織殺細胞処理と腫瘍治療への応用,"山岡 哲二, 神野 千鶴, 馬原 淳, 森本 尚樹",生体医工学,Annual56,Abstract,S260,2018
3007,脱臼防止機構付き人工股関節の力学的評価,"川村 勇樹, 今井 大貴, 谷藤 祐紀, 山本 衛",生体医工学,Annual56,Abstract,S26,2018
3008,心室筋ＥＣＭゲルの作製および細胞培養適合性の検討,"樋口 俊介, 藤田 恭平, 小松 由佳, 馮 忠剛, 小沢田 正, 佐藤 大介, 中村 孝夫, 白石 泰之, 梅津 光生",生体医工学,Annual56,Abstract,S259,2018
3009,大気圧プラズマ照射による細胞膜性状変化の過程,"矢野 哲也, 小笠原 知里, 八尾谷 亮太",生体医工学,Annual56,Abstract,S258,2018
3010,歯根膜細胞における機械刺激による恒常性への影響,"藤田 彩乃, 森松 賢順, 西山 雅祥, 高柴 正悟, 成瀬 恵治",生体医工学,Annual56,Abstract,S257,2018
3011,高圧下での細胞動態イメージング,"森松 賢順, 藤田 彩乃, 綾 晃記, 西山 雅祥, 成瀬 恵治",生体医工学,Annual56,Abstract,S256,2018
3012,低強度の紫外線を照射した皮膚組織の力学的特性評価,"今井 大貴, 川村 勇樹, 竹森 久美子, 伊藤 浩行, 山本 衛",生体医工学,Annual56,Abstract,S255,2018
3013,医療用RFID開発のこれまでの経緯,"保坂 良資, 川上 裕生",生体医工学,Annual56,Abstract,S254,2018
3014,高解像カメラによる手術器材の複数一括認識の検証と今後に向けて,"三浦 寿朗, 川口 弘之",生体医工学,Annual56,Abstract,S253-02,2018
3015,医療分野におけるICタグの活用可能性,平野 義明,生体医工学,Annual56,Abstract,S253-01,2018
3016,2チャネル下肢表面筋電図による周期性四肢運動の終夜観察,"江口 佳那, 南部 雅幸, 黒田 知広",生体医工学,Annual56,Abstract,S252,2018
3017,a面配向ハイドロキシアパタイト膜の結晶成長メカニズム,"渡部 由香, 岡田 悠希, 常峰 知也, 楠 正暢",生体医工学,Annual56,Abstract,S251,2018
3018,c面配向アパタイト結晶膜作製に必要なバッファ層の臨界膜厚,"岡田 悠希, 楠 正暢",生体医工学,Annual56,Abstract,S250,2018
3019,イメージマッチングによる橈骨手根関節の生体内接触挙動評価,"小林 公一, 風間 清子, 坂本 信",生体医工学,Annual56,Abstract,S25,2018
3020,硬組織代替材料への応用を目的としたチタン表面への細胞賦活効果の検討,"関根 一光, 馬場 麻人, 浜田 賢一",生体医工学,Annual56,Abstract,S249,2018
3021,生体医工学会における男女平等参画の推進,小谷 博子,生体医工学,Annual56,Abstract,S247,2018
3022,ライフイベントと共生する研究生活を考える―育児と研究の両立について,"山口 さち子, 関野 正樹",生体医工学,Annual56,Abstract,S246,2018
3023,メカジョ(機械系女性)の活躍,繁富 香織,生体医工学,Annual56,Abstract,S245,2018
3024,ライフイベントにおける女性の雇用の限定が日本を滅ぼす,山家 智之,生体医工学,Annual56,Abstract,S244,2018
3025,介護トレーニングロボット関節負荷素材基礎検討技術紹介,"高瀬 潤一, 福井 美宝, 本田 昭洋, 大浦 嘉幸, 志村 孚城",生体医工学,Annual56,Abstract,S243,2018
3026,ICTを用いた高齢者の歩行に着目した健康支援の大規模追跡研究,"山下 知子, 山下 和彦, 清水 裕子, 山田 憲嗣",生体医工学,Annual56,Abstract,S242,2018
3027,転倒予防のための高齢者の歩行診断と歩行訓練システムの開発,"伊藤 友孝, 奥野 彰太, 白井 智貴, 鈴木 みずえ, 谷 重喜",生体医工学,Annual56,Abstract,S241,2018
3028,楽器演奏・音楽療法の認知症予防効果に関する文献レビュー,"赤澤 堅造, 奥野 竜平",生体医工学,Annual56,Abstract,S240,2018
3029,母指指節間関節および中手指節関節の接触運動解析,"坂本 信, 杉田 魁人, 森清 友亮, 風間 清子, 小林 公一, 田邊 裕治",生体医工学,Annual56,Abstract,S24,2018
3030,認知症と運転-平成29年度道路交通法改訂に関連した諸課題-,志村 孚城,生体医工学,Annual56,Abstract,S239,2018
3031,TTLSとシグモイド関数を組み合わせた逆フィルタによる高精度脳皮質電位イメージングの検討,"白戸 元気, 堀 潤一",生体医工学,Annual56,Abstract,S237,2018
3032,てんかん発作初期・中期・収束期における皮質脳波コネクティビティ解析,"田中 綜一郎, 吉田 久, 宮内 正晴, 中野 直樹, 加藤 天美",生体医工学,Annual56,Abstract,S236,2018
3033,皮質-視床-皮質ループ強度の脳波による推定：医用展開に向けた検討,"山口 郁博, 岸 哲史, 東郷 史治, 中村 亨, 山本 義春",生体医工学,Annual56,Abstract,S235,2018
3034,安静時fMRI信号によるインターネット依存者の機能結合解析,栗城 眞也,生体医工学,Annual56,Abstract,S233,2018
3035,皮質脳波/機能的MRIによる脳内身体表現マーカーの探索,"鎌田 恭輔, 小川 博司, 広島 覚, 竹内 文也",生体医工学,Annual56,Abstract,S232,2018
3036,運動タイミングを決める皮質下機構,田中 真樹,生体医工学,Annual56,Abstract,S231,2018
3037,低酸素環境下での運動と認知機能,安藤 創一,生体医工学,Annual56,Abstract,S230,2018
3038,腱-骨付着部の材料特性のラマン分光計測,"藏田 耕作, 岩田 季久, 田中 康嗣, 金澤 知之進, 後藤 昌史, 高松 洋",生体医工学,Annual56,Abstract,S23,2018
3039,低酸素による脳血管のリモデリング：毛細血管の３次元ネットワークの可視化と定量化,正本 和人,生体医工学,Annual56,Abstract,S228,2018
3040,貴金属ナノ周期構造を有するプラズモニック光学デバイスを用いた生体機能計測への応用,"遠藤 達郎, 長島 優, 山田 憲嗣",生体医工学,Annual56,Abstract,S227,2018
3041,ラマンスペクトル波形を用いたFabry病患者組織中の異常脂質蓄積の定量的可視化法,"長島 優, 岩田 淳, 吉岡 考高, 大間知 潤子, 清水 潤, 戸田 達史, 湯本 潤司, 五神 真",生体医工学,Annual56,Abstract,S226,2018
3042,勤労者の日常生活下における行動、心理、生理状態の統合連続モニタリング,"志村 広子, 中村 亨, 山本 義春",生体医工学,Annual56,Abstract,S225,2018
3043,大規模身体加速度データベースの利活用による行動インフォマティクス,"中里 崇寛, 李 俐, 中村 亨",生体医工学,Annual56,Abstract,S224,2018
3044,ビッグデータから見た身体活動の曜日による変動,"吉田 豊, 古川 由己, 湯田 恵美, 早野 順一郎",生体医工学,Annual56,Abstract,S223,2018
3045,ビッグデータの統計学的意義,"早野 順一郎, 古川 由己, 吉田 豊, 湯田 恵美",生体医工学,Annual56,Abstract,S222,2018
3046,ビッグデータによる心拍変動の因子分析,"湯田 恵美, 吉田 豊, 早野 順一郎",生体医工学,Annual56,Abstract,S221,2018
3047,医用画像の機械学習,"間普 真吾, 木戸 尚治, 橋本 典明, 平野 靖, 呉本 尭",生体医工学,Annual56,Abstract,S220-2,2018
3048,衝撃荷重による足指骨折の発生条件の解明に関する研究,"プラムディタ ジョナス　アディティヤ, 鈴木 一成, 齋藤 侑樹, 田邊 裕治",生体医工学,Annual56,Abstract,S22,2018
3049,Deep Learningのバイオメディカルデータへの応用,新岡 宏彦,生体医工学,Annual56,Abstract,S219-1,2018
3050,医療レギュラトリーサイエンス分野の博士人材育成の難しさ,"梅津 光生, 岩﨑 清隆, 伊関 洋, 松橋 祐輝, 坪子 侑佑, 笠貫 宏",生体医工学,Annual56,Abstract,S218-2,2018
3051,兵庫県立大学における先端医工学研究センター立ち上げについて,小橋 昌司,生体医工学,Annual56,Abstract,S218-1,2018
3052,医工連携と教育研究：広島における取り組み,増谷 佳孝,生体医工学,Annual56,Abstract,S217-2,2018
3053,大学における臨床工学技士教育の課題と展望,篠原 一彦,生体医工学,Annual56,Abstract,S217-1,2018
3054,地域包括ケアを支える遠隔看護,川口 孝泰,生体医工学,Annual56,Abstract,S216,2018
3055,IoT デバイスの医療機器としての利用への展望と課題,木村 映善,生体医工学,Annual56,Abstract,S215,2018
3056,離島と地域を支える遠隔医療ー長崎県における取り組みー,立石 憲彦,生体医工学,Annual56,Abstract,S214,2018
3057,テレビ電話を用いた1型糖尿病をもつ子どもへの遠隔看護の経験から20年,中村 慶子,生体医工学,Annual56,Abstract,S213,2018
3058,排泄データの非接触測定に関する研究,"中島 一樹, 金山 義男, 飯國 高弘, 杉本 涼輔, 池上 駿介, 中川 新太, 井上 大輔, 長田 任一哉, 藤井 努, 萩原 衛, 戸田 和成, 北村 寛",生体医工学,Annual56,Abstract,S212,2018
3059,排便性状評価のためのラインセンサを用いた時空間画像処理,"河中 治樹, 本多 千鶴, 小栗 宏次",生体医工学,Annual56,Abstract,S211,2018
3060,かわや日記帳ー在宅排泄モニタリング用端末と運用システムの開発,"山本 強, 堀内 龍, 橘田 岳也, 篠原 信雄",生体医工学,Annual56,Abstract,S210,2018
3061,海綿骨骨梁のアパタイト量調整が力学特性に与える影響,"藤崎 和弘, 齋藤 直也, 森脇 健司, 笹川 和彦",生体医工学,Annual56,Abstract,S21,2018
3062,最新トイレの医工学,"小栗 宏次, 河中 治樹",生体医工学,Annual56,Abstract,S209,2018
3063,ウエアラブルNIRSを用いたドライバの脳機能計測と評価,綱島 均,生体医工学,Annual56,Abstract,S208,2018
3064,NIRSを用いたロボットの外観評価に関する基礎的検討,"柳澤 一機, 森 拓也, 安野 修平, 綱島 均",生体医工学,Annual56,Abstract,S207,2018
3065,ラジコンカーの操作が脳活動に及ぼす影響,"中村 清志郎, 日和 悟, 廣安 知之",生体医工学,Annual56,Abstract,S206,2018
3066,NIRSをマーケティングに活用する 事例2 コールセンター「良い対話」の評価,"落合 俊行, 菅沼 満, 榊 晶子, 中川 雅文",生体医工学,Annual56,Abstract,S205,2018
3067,NIRSをマーケティングに活用する 事例1 ダイレクトメールの評価,"中川 雅文, 落合 俊行, 榊 晶子, 菅沼 満",生体医工学,Annual56,Abstract,S204,2018
3068,リハビリテーションにおけるfNIRS測定時の頭皮血流問題とその対応,武田 湖太郎,生体医工学,Annual56,Abstract,S203,2018
3069,fNIRSを用いたhyperscanningによる協調時の脳活動の検討,"谷口 尚, 日和 悟, 廣安 知之",生体医工学,Annual56,Abstract,S202,2018
3070,内耳の感覚上皮ナノ振動の３次元計測を志向した新規光干渉顕微鏡の創製,"任 書晃, 崔 森悦, 太田 岳, 日比野 浩",生体医工学,Annual56,Abstract,S201,2018
3071,内耳のナノ振動計測を標的とした改良型レーザー干渉法の創出,"太田 岳, 崔 森悦, 任 書晃, 日比野 浩",生体医工学,Annual56,Abstract,S200,2018
3072,動的粘弾性Optical Coherence Straingraphyを用いた軟骨組織の力学特性マイクロ断層可視化の検討,"佐伯 壮一, 古川 大介, 中村 卓, 池淵 充彦, 中村 博亮, 新実 信夫, 塚原 義人",生体医工学,Annual56,Abstract,S20,2018
3073,新生児のための聴覚スクリーニング装置の開発,"村越 道生, 濱西 伸治, 和田 仁",生体医工学,Annual56,Abstract,S199,2018
3074,再帰型ニューラルネットワークによるマイクロサッカード検出手法,"宮竹 海地, 小濱 剛, 吉田 久",生体医工学,Annual56,Abstract,S198,2018
3075,網膜刺激型人工視覚におけるAnodic-first非対称パルス刺激の効果,"中野 由香梨, 寺澤 靖雄, 神田 寛行, 澤井 元",生体医工学,Annual56,Abstract,S197,2018
3076,慣性センサによる体重心位置軌跡の推定に関する基礎的検討,"武田 優帆, 内藤 望実, 渡邉 高志",生体医工学,Annual56,Abstract,S196,2018
3077,家庭用手指リハビリ機器における麻痺の回復度自動評価システムの生理学的妥当性向上法の検討,"古館 裕大, 山本 一希, 千葉 馨, 石田 裕二, 三上 貞芳",生体医工学,Annual56,Abstract,S195,2018
3078,磁気式モーションキャプチャを用いた採血手技における指使いの特徴抽出,"齋藤 正親, 菊地 由紀子, 工藤 由紀子, 佐々木 真紀子, 水戸部 一孝",生体医工学,Annual56,Abstract,S194,2018
3079,EAMブレーキを用いた上肢サポート装具の開発に関する基礎的研究,"中條 龍一, 佐藤 明美, 黒柳 亮太, 長妻 明美, 安齊 秀伸, 三井 和幸",生体医工学,Annual56,Abstract,S193,2018
3080,無意識・無拘束生体計測システムによる脊髄損傷患者の心肺機能及び活動評価に関する基礎的検討,"本井 幸介, 樫本 敬亮, 山越 康弘, 田中 直登, 有地 祐人, 吉弘 愛, 江原 喜人, 坂井 宏旭, 山越 憲一",生体医工学,Annual56,Abstract,S192,2018
3081,脊髄損傷アスリート用体温調節システムの開発,"吉村 拓巳, 田村 俊世, 黄 銘",生体医工学,Annual56,Abstract,S191,2018
3082,義手ソケット冷却法の体表面温度上昇抑制効果の比較,"大西 謙吾, 神田 智基",生体医工学,Annual56,Abstract,S190,2018
3083,ラマン分光法によるブタ膝関節軟骨の力学挙動解析,"東藤 正浩, 北山 美咲",生体医工学,Annual56,Abstract,S19,2018
3084,ペンドラムテストにおける大腿骨―脛骨接触点移動の下腿運動への影響,"道西 博行, 楠原 俊昌, 中村 隆夫, 軸屋 和明, 山本 尚武, 岡本 卓爾",生体医工学,Annual56,Abstract,S189,2018
3085,ペンドラムテスト開始時における大腿部動揺の下腿部運動波形への影響,"楠原 俊昌, 中村 隆夫, 道西 博行, 軸屋 和明, 山本 尚武, 岡本 卓爾",生体医工学,Annual56,Abstract,S188,2018
3086,ペンドラムテストにおける下腿部支持解除の反射評価結果への影響,"中村 隆夫, 楠原 俊昌, 道西 博行, 軸屋 和明, 山本 尚武, 岡本 卓爾",生体医工学,Annual56,Abstract,S187,2018
3087,fNIRS国際規格ISO/IEC80601-2-71検討の経緯,江田 英雄,生体医工学,Annual56,Abstract,S186,2018
3088,顔動画の特徴点検出を利用したfNIRSプローブ装着位置ナビゲーター,"川口 拓之, 山田 亨",生体医工学,Annual56,Abstract,S185,2018
3089,fNIRSによる脳損傷サルの運動関連領野モニタリング,"山田 亨, 川口 拓之, 加藤 準平, 松田 圭司, 肥後 範行",生体医工学,Annual56,Abstract,S184,2018
3090,脳波，脳血流（fNIRS）および瞳孔径信号を用いた単語記憶課題の成績評価,"沼田 崇志, 木口 雅史, 佐藤 大樹",生体医工学,Annual56,Abstract,S183,2018
3091,透析低血圧への試験的対処法の血液循環,"山下 政司, 横山 徹, 北間 正崇, 相川 武司",生体医工学,Annual56,Abstract,S182,2018
3092,ロボット補助下前立腺全摘除術における尿道作用力分析と作用力重畳表示システムの開発,"高安 健太, 西山 周平, 黒田 嘉宏, 安藤 英由樹, 吉田 健志, 松田 公志",生体医工学,Annual56,Abstract,S181,2018
3093,スマートフォンを用いた簡便で迅速な尿成分の半定量システム開発に向けた基礎的検討,"金田 晃明, 横山 徹, 木村 主幸, 清水 久恵, 山下 政司, 印藤 智一",生体医工学,Annual56,Abstract,S180,2018
3094,生体外でのコラーゲン原線維の修復,"山本 憲隆, 前嶋 風輝",生体医工学,Annual56,Abstract,S18,2018
3095,尿中バイオマーカーの分光的検出に向けた基礎的検討―微量アルブミンの高感度比色定量法の構築―,"横山 徹, 菅原 俊継, 相川 武司, 渡邉 翔太郎, 清水 久恵, 山下 政司, 印藤 智一, 三浦 寛子, 黒田 聡, 木村 主幸",生体医工学,Annual56,Abstract,S179,2018
3096,超音波エコーを用いた灌流腎画像評価法の検討,"宮崎 洵, 小倉 亮介, 吉池 成弥, 岩永 進太郎, 黒岡 武俊, 中村 真人",生体医工学,Annual56,Abstract,S178,2018
3097,呼吸性変位を表現可能な複数臓器の統計的変位モデル構築の試み,"岩井 泰児, 中尾 恵, 中村 光宏, 松田 哲也",生体医工学,Annual56,Abstract,S177,2018
3098,自家蛍光を用いた高ロバストな蛍光寿命イメージング技術の開発,"伊藤 駿太郎, 橋本 将明, 田口 良広",生体医工学,Annual56,Abstract,S176,2018
3099,超音波ボリュームの時系列輝度解析による極細カテーテル先端位置の検出方法の検討,"神田 浩輔, 木村 允俊, 片井 拓弥, 鈴木 俊哉, 牛水 英貴, 小野木 真哉, 絵野沢 伸, 桝田 晃司",生体医工学,Annual56,Abstract,S175,2018
3100,内視鏡把持ロボット制御のための手術器具のビジュアルトラッキング,"遠藤 航, 岩本 憲泰, 河合 俊和, 鈴木 寿, 片井 均, 西川 敦",生体医工学,Annual56,Abstract,S174,2018
3101,手術器具把持ロボット制御のための器具先端の実時間高精度内視鏡画像合成手法,"熊王 彰吾, 岩本 憲泰, 河合 俊和, 鈴木 寿, 片井 均, 西川 敦",生体医工学,Annual56,Abstract,S173,2018
3102,早期ウィルス感染症検知マイクロデバイスの開発,"木村 雄亮, 池内 真志, 井上 佳則, 生田 幸士",生体医工学,Annual56,Abstract,S172,2018
3103,小動物体外循環血液光照射実験法の作成と照射影響の探索,"大井 文香, 中川 忠彦, 玉井 瑠人, 岡本 耕一, 高山 哲治, 曽我部 正弘, 岡久 稔也, 芥川 正武, 榎本 崇宏, 原口 雅宣, 木内 陽介",生体医工学,Annual56,Abstract,S171,2018
3104,マイクロ加工を利用した電気インピーダンスによる細胞の配向方向検出,"橋本 成広, 田村 卓也, 高橋 優輔, 日野 遥",生体医工学,Annual56,Abstract,S170,2018
3105,微細溝コラーゲン基質を用いた血管平滑筋細胞の配列培養組織形成と核のメカノトランスダクション解析,長山 和亮,生体医工学,Annual56,Abstract,S17,2018
3106,バイオセンサの高感度化に用いる光開裂性マイクロカプセルによるシグナル増幅法,山口 昌樹,生体医工学,Annual56,Abstract,S169,2018
3107,酸化チタンを用いた有機物の臭気除去の定量的研究,"長倉 俊明, 門田 直之, 木戸 倫子, 大野 ゆう子, 石井 豊恵, 山田 憲嗣",生体医工学,Annual56,Abstract,S168,2018
3108,神経活動パターンの多様性と秩序：“生命知能”の源泉を探る,高橋 宏知,生体医工学,Annual56,Abstract,S167,2018
3109,泳ぐ神経細胞といわれる繊毛虫の適応行動と制御,"中垣 俊之, 山口 達也",生体医工学,Annual56,Abstract,S166,2018
3110,マウス聴覚皮質におけるサブ領域および層依存的な神経応答のダイナミクス,西川 淳,生体医工学,Annual56,Abstract,S165,2018
3111,予測学習による階層型リカレントニューラルネットワークの空間表象の獲得,飯塚 博幸,生体医工学,Annual56,Abstract,S164,2018
3112,ＣＣＥＰを用いた覚醒下手術における超受動的言語機能マッピング,"鎌田 恭輔, 小川 博司, 田村 有希恵, 広島 覚, 竹内 文也",生体医工学,Annual56,Abstract,S163,2018
3113,患者が喜ぶ医療現場の実現のために電波利用推進を,石原 謙,生体医工学,Annual56,Abstract,S162,2018
3114,医療の電磁波はどこで何が問題なのか,長倉 俊明,生体医工学,Annual56,Abstract,S161,2018
3115,九州地域における協議会の発足とこれからの展望,花田 英輔,生体医工学,Annual56,Abstract,S160,2018
3116,内圧負荷における大動脈組織のミクロスケール3次元変形解析,"杉田 修啓, 加藤 雅也, 中村 匡徳",生体医工学,Annual56,Abstract,S16,2018
3117,医療機関における安心・安全な電波利用の推進に向けた取組,平野 友貴,生体医工学,Annual56,Abstract,S159,2018
3118,寝返りを考慮したオプティカルフローによる呼吸計測方法の検討,"加藤 綾子, 森山 悠里加, 福井 康裕",生体医工学,Annual56,Abstract,S158,2018
3119,睡眠時の無呼吸検出に向けた非接触脈拍数モニタリングの検証,"前田 祐佳, 伊藤 駿史, 関根 正樹, 田村 俊世",生体医工学,Annual56,Abstract,S157,2018
3120,看護業務の変革に向けた支援技術の検討,瀬戸 僚馬,生体医工学,Annual56,Abstract,S156,2018
3121,看護業務の効率化と最適化の違い,脇坂 仁,生体医工学,Annual56,Abstract,S155,2018
3122,よりよい看護実践のための電子カルテの将来像,滝沢 礼子,生体医工学,Annual56,Abstract,S154-3,2018
3123,業務改革に向けた位置情報システムの実装,矢嶋 知己,生体医工学,Annual56,Abstract,S154-2,2018
3124,看護現場と支援技術,保坂 良資,生体医工学,Annual56,Abstract,S154-1,2018
3125,多様な内蔵モニタ機能を有する長期耐久性に優れた超小型ECMOシステムの開発と中長期慢性動物実験による評価,"片桐 伸将, 武輪 能明, 築谷 朋典, 水野 敏秀, 竹下 大輔, 秋山 大地, 巽 英介",生体医工学,Annual56,Abstract,S152,2018
3126,時空間興奮分散を指標にした心房細動治療法,"山崎 正俊, 富井 直輝, 佐久間 一郎",生体医工学,Annual56,Abstract,S150,2018
3127,高血圧に伴う肥厚メカニズムの解明に向けた動脈壁変形のマルチスケール計測,松本 健郎,生体医工学,Annual56,Abstract,S15,2018
3128,心臓旋回性興奮動態の位相分散解析,"富井 直輝, 瀬野 宏, 山崎 正俊, 本荘 晴朗, 柴田 仁太郎, 佐久間 一郎",生体医工学,Annual56,Abstract,S149,2018
3129,臨床不整脈映像化システムによる非発作性心房細動の維持機構の解明：ExTRa Mapping Project,"坂田 憲祐, 奥山 雄介, 小澤 友哉, 原口 亮, 稲田 慎, 中沢 一雄, 土谷 健, 芦原 貴司",生体医工学,Annual56,Abstract,S148,2018
3130,水銀血圧計との比較によるカフなし血圧推定値の評価,"江田 英雄, 山崎 まどか",生体医工学,Annual56,Abstract,S145,2018
