No,Title,Author,Journal,Vol,No,Pages,Published_Year
4322,難聴に関わる変異タンパク質ペンドリンを回復させる化合物の評価法開発,"小池 勇飛, 村越 道生",生体医工学,Annual59,Proc,757-758,2021
4323,非一様弾性場・非定住培養における細胞内張力揺らぎ増強効果,"江端 宏之, 木戸秋 悟",生体医工学,Annual59,Proc,754-756,2021
4324,トンネル磁気抵抗素子を用いた室温脳磁計による体性感覚誘発磁界の測定,"菅野 彰剛, 大兼 幹彦, 藤原 耕輔, 松﨑 斉, 安藤 康夫, 中里 信和",生体医工学,Annual59,Proc,752-753,2021
4325,Dependency of the medial gastrocnemius muscle and ankle joint stiffness on the dorsiflexion angle,"小田 大聖, Takanori Uchiyama",生体医工学,Annual59,Proc,749-751,2021
4326,Stiffness estimation of the vastus lateralis muscle in quiet standing,"石井 光月, Takayori Uchiyama",生体医工学,Annual59,Proc,746-748,2021
4327,破壊兆候を検知する脳外科手術用レトラクタの開発,"望月 遼一, 田中 慎吾, 笹川 泰生, 中田 光俊, 渡辺 哲陽",生体医工学,Annual59,Proc,743-745,2021
4328,背側からの神経磁界測定による腕神経叢の神経機能評価,"石田 洸樹, 渡部 泰士, 川端 茂徳, 橋本 淳, 大川 淳",生体医工学,Annual59,Proc,740-742,2021
4329,ハイブリッドセルを用いた光ポンピング磁気センサのグラジオメータ構成に関する検討,"南部 康太, 伊藤 陽介, 小林 哲生",生体医工学,Annual59,Proc,737-739,2021
4330,神経活動モデルとして電流ダイポールを用いた超低磁場機能的核磁気共鳴画像法の検討,"樋口 正法, 上原 弦",生体医工学,Annual59,Proc,735-736,2021
4331,低磁場fMRIに向けたスピンロックシーケンスの検討: MR画像のノイズが磁場検出に及ぼす影響,"上田 博之, 伊藤 陽介, 谷口 陽, 小林 哲生",生体医工学,Annual59,Proc,732-734,2021
4332,脳磁計における冷凍機由来ノイズ除去のためのモバイルリファレンスセンサ,"小山 大介, 河合 淳, 河端 美樹, 足立 善昭",生体医工学,Annual59,Proc,729-731,2021
4333,ベクトル型磁束計は全頭型脳磁計のヘルメット辺縁部の等価電流双極子位置推定精度を改善するか？,足立 善昭,生体医工学,Annual59,Proc,726-728,2021
4334,メロディー輪郭の変化に対するミスマッチ・ネガティビティの計測：輪郭形状の影響,"内藤 柚菜, ヤップ・ゲック シエン, 柴 玲子, 大塚 翔, 湯本 真人, 中川 誠司",生体医工学,Annual59,Proc,723-725,2021
4335,多チャンネル表面筋電図と超音波画像を用いた新たな筋肉の評価の検討,"山口 雄大, 小菅 智裕, 熊谷 寛",生体医工学,Annual59,Proc,720-722,2021
4336,眼電図と口の動作に伴う筋電図を用いたポインティングデバイスの開発,"齋藤 瞭汰, 堀 潤一",生体医工学,Annual59,Proc,718-719,2021
4337,低負荷なストレス測定アルゴリズムの検討,"佐山 幸和, 島田 尊正, 阪田 治",生体医工学,Annual59,Proc,716-717,2021
4338,パターン識別を用いた筋電信号自動調整処理の効果,"内藤 賢宏, 大西 謙吾",生体医工学,Annual59,Proc,713-715,2021
4339,医療機関における簡易電波環境測定手法の提案,石田 開,生体医工学,Annual59,Proc,710-712,2021
4340,他者との注意共有の神経基盤：ハイパースキャニングfMRIを用いた検討,小池 耕彦,生体医工学,Annual59,Proc,707-709,2021
4341,振動測定に基づく補助循環療法中に発生する異常発見に関する検討,"武笠 聡輝, 奥 知子, 山内 忍, 本橋 由香, 佐藤 敏夫",生体医工学,Annual59,Proc,705-706,2021
4342,血管へばりつきと再循環率の同時評価システムを用いたDLCの性能評価,"佐々木 優貴乃, 島崎 直也, 中根 紀章, 奥 知子, 山内 忍, 本橋 由香, 佐藤 敏夫",生体医工学,Annual59,Proc,703,2021
4343,血液回路振動の連続測定による脱血不良のモニタリング方法,"船場 大地, 森屋 雄斗, 奥 知子, 山内 忍, 本橋 由香, 佐藤 敏夫",生体医工学,Annual59,Proc,701-702,2021
4344,カゼインミセルの形成を利用した静脈エアトラップチャンバ内の血液凝固の模擬方法,"巻田 浩輝, 奥 知子, 山内 忍, 本橋 由香, 佐藤 敏夫",生体医工学,Annual59,Proc,699-700,2021
4345,血液透析用留置針の形状が実流量に及ぼす影響に関する実験的検討,"富 弘樹, 奥 知子, 山内 忍, 本橋 由香, 佐藤 敏夫",生体医工学,Annual59,Proc,697-698,2021
4346,血液透析中の血液凝固を防ぐ静脈側エアトラップチャンバの最適形状に関するCFD解析,"島崎 直也, 新江 義正, 奥 知子, 山内 忍, 本橋 由香, 佐藤 敏夫",生体医工学,Annual59,Proc,694-696,2021
4347,血液透析患者のシャント音の音響特性に及ぼす狭窄病変長の影響,"新江 義正, 奥 知子, 山内 忍, 本橋 由香, 佐藤 敏夫",生体医工学,Annual59,Proc,692-693,2021
4348,画像解析による尿試験紙判定システム構築に向けた尿アルブミンにおける基礎的検討,"木田 直弥, 横山 徹, 清水 久恵, 山下 政司",生体医工学,Annual59,Proc,690-691,2021
4349,複数の日常行動情報におけるMCIスクリーニング；日常会話によるMCI検出手法の検討,"山中 綾華, 佐藤 生馬, 藤野 雄一, 松本 修一",生体医工学,Annual59,Proc,687-689,2021
4350,屋外における高齢者見守りに有効な情報とその共有についての検討,"戸谷 伸之, 松田 成司, 中島 潤",生体医工学,Annual59,Proc,685-686,2021
4351,筋力学特性と運動単位活動に基づく単一筋の位置制御の理論,赤澤 堅造,生体医工学,Annual59,Proc,682-684,2021
4352,超音波ボリュームの4次元解析による極細カテーテルの先端位置の推定,"武井 真輝, 清水 太一, 小林 勇太郎, 桝田 晃司",生体医工学,Annual59,Proc,680-681,2021
4353,超音波による3次元肝血管網の構造解析と体勢・呼吸に対する変形評価,"岩崎 弘益, 岡留 寛斉, 渡邉 晃介, 桝田 晃司",生体医工学,Annual59,Proc,678-679,2021
4354,脳機能ドックにおけるDSSPの有効性評価,"工藤 俊介, 金矢 光久, 冨田 教幸",生体医工学,Annual59,Proc,675-677,2021
4355,病変を有するてんかんにおける斜磁振動トポグラフィーによるhigh frequency oscillationsの評価,"岡村 朗健, 橋詰 顕, 香川 幸太, 片桐 匡弥, 瀬山 剛, 栗栖 薫, 飯田 幸治",生体医工学,Annual59,Proc,672-674,2021
4356,中心溝近傍病変による非典型的な体性感覚機能局在を誘発磁界により予測できた一例,"石田 誠, 柿坂 庸介, 菅野 彰剛, 大沢 伸一郎, 浮城 一司, 神 一敬, 冨永 悌二, 中里 信和",生体医工学,Annual59,Proc,670-671,2021
4357,眼球・頭部の向反を伴う焦点意識保持発作を呈する前頭葉てんかんで脳磁図が局在診断に有用だった一例,"土屋 真理夫, 石田 誠, 大沢 伸一郎, 柿坂 庸介, 菅野 彰剛, 神 一敬, 張替 宗介, 中里 信和",生体医工学,Annual59,Proc,667-669,2021
4358,内側側頭葉てんかん術前検査におけるMEG再検の有用性,"白水 洋史, 増田 浩, 福多 真史, 亀山 茂樹",生体医工学,Annual59,Proc,665-666,2021
4359,磁場源推定における不確かさの改善- 隣接する脳磁計に含まれる参照センサを用いて(続報) -,"上原 弦, 小山 大介, 河端 美樹, 足立 善昭, 宮本 政和, 河合 淳, 樋口 正法, 春田 康博",生体医工学,Annual59,Proc,663-664,2021
4360,Frequency characteristics of biomagnetic signals: verification by MEG measurements,"大塚 明香, Hironori Nishimoto, Koichi Yokosawa, Shinya Kuriki",生体医工学,Annual59,Proc,660-662,2021
4361,ハイブリッド型光ポンピング磁気センサによるMEGのガラスセル内多点同時計測,"大谷 康介, 江田 大輝, 伊藤 陽介, 小林 哲生",生体医工学,Annual59,Proc,657-659,2021
4362,視覚誘発信号計測による磁界バイアス式脳機能計測システムの有効性の検証,"松永 諒, 樋脇 治",生体医工学,Annual59,Proc,655-656,2021
4363,MEGハイパースキャニングによる非言語コミュニケーション中の脳領域間の相関活動,"金 柱亨, 小野 弓絵, 高野 一義, 渡辺 隼人, 柳生 一自, 横澤 宏一, 白石 秀明, 齋藤 卓弥",生体医工学,Annual59,Proc,653-654,2021
4364,ハイパースキャニングに用いる２台の脳磁計で推定した脳活動位置の比較,"渡辺 隼人, 下條 暁司, 高野 一義, 大西 祥貴, 白石 秀明, 横澤 宏一",生体医工学,Annual59,Proc,647-649,2021
4365,がん疼痛患者におけるデフォルトモードネットワーク活動の低下,"ベン フェイ, 小川 万由子, 小野 弓絵, リン ブンエイ",生体医工学,Annual59,Proc,644-646,2021
4366,高速度カメラを用いた３方向等角投影によるｅＰＴＦＥ弁葉挙動可視化システムの開発,"永野 友香, 白石 泰之, ナラコット アンドリュー, 山田 昭博, 山岸 正明, 山家 智之",生体医工学,Annual59,Proc,641-643,2021
4367,頭蓋内脳波を用いたブレインマシンインターフェースによるロボットアームの３次元リアルタイム制御,"藏富 壮留, Palmer Jason, 陳 鵬, 姜 銀来, 横井 浩史, 平田 雅之",生体医工学,Annual59,Proc,638-640,2021
4368,ウェアラブル心拍センサを用いたうつ状態の心拍変動と活動量,"小松 陽子, 古賀 賀恵, 篠崎 亮, 清水 祐輔, 功刀 浩",生体医工学,Annual59,Proc,632-634,2021
4369,脳磁図で発作間欠期の鋭一過性波のみ認めた症例での転帰についての検討,"河村 祐貴, 岡田 直, 山田 大輔, 光野 優人, 松橋 眞生, 高橋 良輔, 池田 昭夫",生体医工学,Annual59,Proc,629-631,2021
4370,Free flap perfusion prediction by laser doppler flowmetry based time series analysis.,"兒玉 浩希, Katsuhiro Ishida, Haruyuki Hirayama, Keita Kishi, Takeshi Miyawaki",生体医工学,Annual59,Proc,626-628,2021
4371,運動トレーニングによる心肺機能の強度依存性適応変化,"伊藤 剛, 澤井 亨, 大槻 伸吾, 仲田 秀臣, 嶋田 愛, 中原 英博, 宮本 忠吉",生体医工学,Annual59,Proc,623-625,2021
4372,光電容積脈波を利用した認証に対するなりすまし攻撃への対策検討,"日夏 俊, 鈴木 大輔, 石塚 裕己, 池田 聖, 大城 理",生体医工学,Annual59,Proc,617-619,2021
4373,灸がもたらす温熱刺激が心臓血管応答に及ぼす影響,"中原 英博, 河合 英理子, 伊藤 剛, 宮本 忠吉",生体医工学,Annual59,Proc,614-616,2021
4374,筋電図波形と音響信号を用いたブラキシズム及び擬似クレンチングの自動検出,"長崎 光弘, Hoang Dinh Loc, 西村 多寿子, 峯松 信明, 水口 一, 窪木 拓男",生体医工学,Annual59,Proc,611-613,2021
4375,ゼロリスク社会における在宅血液透析の安全性保障に必要な生体医工学技術,"政金 生人, 古薗 勉, 若井 陽希",生体医工学,Annual59,Proc,609-610,2021
4376,認知症予防を目指した楽器演奏・音楽療法,"赤澤 堅造, 奥野 竜平, 一ノ瀬 智子, 田部井 賢一, 近藤 瑛佑",生体医工学,Annual59,Proc,606-608,2021
4377,要介護者のQOL向上を意識した生活プログラム生成システムの開発,浅川 毅,生体医工学,Annual59,Proc,603-605,2021
4378,Paradigm-shifted research on Dementia and Appropriate Biomedical Engineering for it,志村 孚城,生体医工学,Annual59,Proc,600-602,2021
4379,ペン先軌道生成モデルを利用したTrail Making Testによる認知機能評価,"兼折 美帆, 阪井 浩人, 古居 彬, 濱 聖司, 柳川 亜紀子, 久保 晃紀, 森迫 優太郎, 折野 佑樹, 濱井 万穂, 藤田 佳純, 水口 寛彦, 神鳥 明彦, 辻 敏夫",生体医工学,Annual59,Abstract,597,2021
4380,iPadの画像解析を用いた自宅リハビリ支援システムの開発,"田脇 裕太, 孫 暁白",生体医工学,Annual59,Abstract,596,2021
4381,PHRでの活用を目的とした身体機能年齢に関する基礎的検討,"瀬戸 僚馬, 今泉 一哉",生体医工学,Annual59,Abstract,595,2021
4382,再建乳房と対側乳房の形状差を導出する乳房再建術中支援システム,"金子 晃太郎, 鈴木 孝司, 千葉 慎二, 鷲尾 利克, 辛川 領, 矢野 智之, 荒船 龍彦",生体医工学,Annual59,Abstract,594,2021
4383,手術支援AIの高難易度症例に向けた学習データの疑似生成に関する研究,"木村 美咲子, 竹下 海斗, 松延 佑将, 篠塚 賢一, 中沼 寛明, 藤永 淳郎, 遠藤 裕一, 衛藤 剛, 猪股 雅史, 徳安 達士",生体医工学,Annual59,Abstract,592,2021
4384,腹腔鏡下胆嚢摘出術における手術工程の自動認識に関する研究,"鶴田 沙也加, 篠塚 賢一, 松延 佑将, 上山 都士也, 田中 雄己, 江部 康平, 中沼 寛明, 藤永 淳郎, 遠藤 裕一, 衛藤 剛, 猪股 雅史, 徳安 達士",生体医工学,Annual59,Abstract,591,2021
4385,Surgical instruments segmentation using Automatic annotation method,"松崎 博貴, Hiro Hasegawa, Nobuyoshi Takeshita, Masaaki Ito",生体医工学,Annual59,Abstract,590,2021
4386,肝臓血管の変動追従のための2D-3D超音波画像レジストレーション手法の開発,"清水 太一, 牧野 雄一, 岡留 寛斉, 桝田 晃司",生体医工学,Annual59,Abstract,589,2021
4387,カメラ画像からの爪床検出とペン型圧迫器を用いた毛細血管再充満時間測定法の検討,"清水 里佳, 篠崎 真良, 齋藤 大輝, 吉村 裕一郎, 中田 孝明, 中口 俊哉",生体医工学,Annual59,Abstract,588,2021
4388,測定条件フィードバック機能を有する爪床圧迫テスト定量化装置の開発,"篠崎 真良, 中口 俊哉, 羽石 秀昭, 中田 孝明",生体医工学,Annual59,Abstract,587,2021
4389,RGBカメラを用いた自律神経系の非接触計測,"辻 涼平, 岡田 志麻, 王 天一",生体医工学,Annual59,Abstract,586,2021
4390,光電脈波計測におけるセンサ間距離が体動アーチファクトに与える影響,"任田 崇吾, 田町 臣悟, 松村 健太",生体医工学,Annual59,Abstract,585,2021
4391,脳トレゲーム実施時のNIRSによる脳反応と仕事負担量の関連性の評価,"福田 恵子, 齋藤 海美",生体医工学,Annual59,Abstract,584,2021
4392,深さ選択性近赤外光アルゴリズムの脳機能計測への適用,"福田 恵子, 若松 大和, 藤井 麻美子",生体医工学,Annual59,Abstract,583,2021
4393,ニューロリハビリテーションでの利用を想定した高密度近赤外分光計測ウェアラブル装置の開発,"山田 亨, 大橋 三男, 川口 拓之, 松田 圭司, 肥後 範行",生体医工学,Annual59,Abstract,582,2021
4394,黄体期にある性成熟期女性におけるN-back課題遂行時の前額部のNIRS計測,"青木 真希子, 鈴木 雅登, 鈴木 聡, 高尾 秀伸, 伊藤 駿, 安西 凌真, 岡山 久代",生体医工学,Annual59,Abstract,581,2021
4395,非線形ラマン散乱硬性内視鏡と深層学習による実時間神経抽出,"大和 尚記, 松谷 真奈, 新岡 宏彦, 三宅 淳, 橋本 守",生体医工学,Annual59,Abstract,580,2021
4396,インドシアニングリーンを用いた人工肺のリアルタイム血栓検出法,"櫻井 啓暢, 藤原 立樹, 大内 克洋, 土方 亘, 井上 雄介, 水野 友裕, 荒井 裕国",生体医工学,Annual59,Abstract,579,2021
4397,経穴の吸光特性に関する基礎研究,"猪寺 伸二, 佐野 元昭, 平井 紀光",生体医工学,Annual59,Abstract,578,2021
4398,透析液排液成分の光学的モニタリングに関する基礎的検討,"佐内 佳太, 鈴木 郁斗, 野川 雅道, 内藤 尚, 西川 裕一, 畑中 由佳, 五十嵐 朗, 小川 充洋, 山越 憲一, 田中 志信",生体医工学,Annual59,Abstract,577,2021
4399,光音響イメージングを用いた多波長解析による皮膚光老化メカニズム解明のための基礎的検討,"竹嶋 悠菜, 浪田 健, 近藤 健悟, 山川 誠, 椎名 毅",生体医工学,Annual59,Abstract,576,2021
4400,照度差ステレオ法における撮影・法線算出条件の検討による舌の裂紋検出システムの構築,"石川 堅也, 野口 桂冴, 吉村 裕一郎, 渡邊 悠紀, 並木 隆雄, 中口 俊哉",生体医工学,Annual59,Abstract,575,2021
4401,樹木由来の香り物質が高齢者の主観的睡眠感および睡眠変数に及ぼす影響,"大平 雅子, 金子 俊彦, 小澤 洋平",生体医工学,Annual59,Abstract,574,2021
4402,心筋梗塞ラットにおいて腎除神経が圧利尿に及ぼす影響の開ループ解析,"川田 徹, 李 梅花, 鄭 燦, 西川 拓也, 朔 啓太, 杉町 勝, 末原 達, 澤田 賢志",生体医工学,Annual59,Abstract,573,2021
4403,極微弱光計測技術を応用した皮膚酸化ストレスの非侵襲的評価,"土田 克彦, 小林 正樹",生体医工学,Annual59,Abstract,572,2021
4404,DDSにおける超音波照射時間と細胞薬物取込の関係に関する研究,"梶江 佳乃, 彭 祖癸, 山本 遥悟, 榛葉 健太, 宮本 義孝, 八木 透",生体医工学,Annual59,Abstract,571,2021
4405,Parkinson's disease classification by residual network type 1-d CNN using vocal datasets,小川 充洋,生体医工学,Annual59,Abstract,570,2021
4406,低温環境下での輸液温の変化 3-輸液回路内の各箇所で測定した輸液の温度について-,"堀田 蛍, 菅原 俊継, 大西 新介, 山下 政司, 清水 久恵",生体医工学,Annual59,Abstract,569,2021
4407,無電化地域における唾液からのウィルス遺伝子検出を可能とする新手法「NEC-SD-LAMP」の開発,"木村 雄亮, 池内 真志",生体医工学,Annual59,Abstract,568,2021
4408,医療費の仕組みを一般的に教育するための医療費計算システムの構築,"神野 睦樹, 大浦 秀斗, 北口 周弘, 木戸 倫子, 長倉 俊明",生体医工学,Annual59,Abstract,567,2021
4409,Development of Music Interactive Online Fitness System,"王 天一, Shima Okada, Masamitsu Kamon, Hirotaka Matsumoto, Yuuya Mizuno, Moemi Saito, Chihiro Tawada, Naruhiro Shiozawa, Masaaki Makikawa",生体医工学,Annual59,Abstract,566,2021
4410,保育業務の暗黙知言語化のための保育データベースシステムの開発,"久保田 知恵, 上村 伸夫, 笠松 幸香, 東山 さとり, 岸本 美保, 来栖 宏二, 川端 茂徳, 荒船 龍彦",生体医工学,Annual59,Abstract,565,2021
4411,手術器械のコンテナセット最適化のための定量評価手法,"楠田 佳緒, 山下 和彦, 石田 志保, 田中 聖人, 正宗 賢, 村垣 善浩",生体医工学,Annual59,Abstract,564,2021
4412,透過膜の性能評価システムの開発,"十川 哲, 山口 湧斗, 金城 知志, 先間 健, 木戸 倫子, 長倉 俊明",生体医工学,Annual59,Abstract,563,2021
4413,DLCコーティングチタンのリン酸カルシウム形成能低減効果,"久保田 康佑, 藤沖 咲良, 吉田 和弘, 酒井 利奈, 氏平 政伸",生体医工学,Annual59,Abstract,562,2021
4414,亜鉛置換ハイドロキシアパタイトナノ粒子複合繊維を用いた抗菌性評価法の検討,"片岡 美波, 東 慶直, 古薗 勉",生体医工学,Annual59,Abstract,561,2021
4415,チタンドープアパタイトナノ粒子の調製と材料特性評価,"丸山 大起, 古薗 勉",生体医工学,Annual59,Abstract,560,2021
4416,磁界ばく露による実験用小動物の行動評価（第2報）,"中田 悠乃, 山本 隆彦, 山田 大輔, 斉藤 顕宜",生体医工学,Annual59,Abstract,559,2021
4417,神経磁場計測システムを用いたラット脊髄の神経活動の可視化,"宮岡 敦史, 川端 茂徳, 橋本 淳, 足立 善昭, 柳沼 秀和, 出口 浩司, 内城 禎久, 渡部 泰士, 石田 洸樹, 細谷 俊彦, 大川 淳",生体医工学,Annual59,Abstract,558,2021
4418,スピンロックシーケンスを用いたMRIによる脳神経磁場計測：雑音磁場が及ぼす影響に関する検討,"遠藤 紘矢, 上田 博之, 伊藤 陽介, 小林 哲生",生体医工学,Annual59,Abstract,557,2021
4419,生体磁気計測のための光ポンピング磁気センサモジュールアレイの開発,"加藤 統久, 山田 将来, 大谷 康介, 伊藤 陽介, 小林 哲生",生体医工学,Annual59,Abstract,556,2021
4420,光ポンピング磁気センサを用いたポンプ光方向操作による磁場方向推定,"浪田 和樹, 伊藤 陽介, 小林 哲生",生体医工学,Annual59,Abstract,555,2021
4421,TMRセンサ心磁計測システムにおけるtSSSアルゴリズムを用いた環境ノイズ低減,"片岡 誠, 加藤 静一, 中村 威信, 市村 翔, 益田 征典, 湯澤 雅樹, 森安 嘉貴, 岡武 茂樹, 安藤 康夫",生体医工学,Annual59,Abstract,554,2021
4422,TMRセンサを用いたリアルタイム心磁図計測,"大兼 幹彦, 菅野 彰剛, 藤原 耕輔, 松崎 斉, 中里 信和, 安藤 康夫",生体医工学,Annual59,Abstract,553,2021
4423,光ポンピング磁気センサを用いた超低磁場MRIの開発：受信周波数特性のシミュレーションよる検討,"堀 壮吾, 笈田 武範, 小林 哲生",生体医工学,Annual59,Abstract,552,2021
4424,RICOH/横河電機 脳磁図データフォーマットとオープンソースによる解析ソフトウェア開発動向,"冨田 教幸, 後藤 一磨, 工藤 究, 奥村 栄一, 金矢 光久, 工藤 俊介, 中田 乙一, 春田 康博, 上原 弦",生体医工学,Annual59,Abstract,551,2021
4425,ポンプ光変調を用いた光ポンピング磁気センサによる平面型多点同時計測,"大村 剛史, 伊藤 陽介, 小林 哲生",生体医工学,Annual59,Abstract,550,2021
4426,生体磁場計測のためのパーマロイ9層可動型高性能磁気シールドルームの開発,"桑波田 晃弘, 山口 孝夫, 伏見 幹史, 隣 真一, 丹羽 祐貴, 関野 正樹",生体医工学,Annual59,Abstract,549,2021
4427,RFパルスを用いたスカラー型光ポンピング磁気センサの原理実証に向けた実験及びその性能評価,"堀 拓真, 後藤 達哉, 伊藤 陽介, 小林 哲生",生体医工学,Annual59,Abstract,548,2021
4428,地磁気環境下におけるスカラー型光ポンピング磁気センサの原子種の違いによる計測感度の比較,"後藤 達哉, 伊藤 陽介, 小林 哲生",生体医工学,Annual59,Abstract,547,2021
4429,高血圧ケアのためのセルフ加圧型血圧計測システムにおける局所圧迫機構および脈波・加圧力計測法の検討,"菅沼 美季, 本井 幸介, 望月 悠佑, 吉田 圭佑, 山越 康弘, 山越 憲一",生体医工学,Annual59,Abstract,546,2021
4430,急角度頭低位の砕石位における全身の体圧変化の特徴,"中嶋 章仁, 石井 豊恵, 井上 文彰, 大野 学, 赤田 いづみ, 山口 亜希子, 福重 春菜, 伊藤 朗子, 三谷 理恵, 中橋 苗代, 平野 方子, 上田 記子, 岡田 志麻",生体医工学,Annual59,Abstract,545,2021
4431,Force Myographyを利用した砲丸投てき動作時の前腕筋収縮タイミングの評価,"王 偉, 藤崎 和弘, 笹川 和彦, 森脇 健司",生体医工学,Annual59,Abstract,544,2021
4432,軟部組織を模擬するモデルを対象とした接触圧分布から押し込み変形量を推定するアルゴリズムの開発,"任 点, 三ツ本 敦子, 新妻 淳子, 外山 滋, 中山 剛, 東 祐二, 太田 裕治",生体医工学,Annual59,Abstract,543,2021
4433,Implement of the Training System for White Cane Technique using Haptic Illusion,"田辺 健, Kiyohiko Nunokawa, Kouki Doi, Shuichi Ino",生体医工学,Annual59,Abstract,542,2021
4434,立ち上がり動作の質的評価,小川 愛実,生体医工学,Annual59,Abstract,541,2021
4435,乳房再建術中のMRグラスによる形状差情報表示,"浅田 菜子, 鈴木 孝司, 千葉 慎二, 鷲尾 利克, 辛川 領, 矢野 智之, 荒船 龍彦",生体医工学,Annual59,Abstract,540,2021
4436,間隔伸張法に基づく記憶トレーニングのためのアプリケーション開発,"渡邊 勇輝, 大塚 日花里, 澤田 砂織, 劉 暢, サントス ルシアーノ, 山本 豪志朗, 岡橋 さやか",生体医工学,Annual59,Abstract,539,2021
4437,機能的電気刺激により取得したヒト肘関節運動モデルを用いた筋電図による運動予測手法の検討,"松居 和寛, 平井 宏明, 西川 敦",生体医工学,Annual59,Abstract,538,2021
4438,変形性膝関節症患者を対象とした下腿回旋による装具ずれを抑制する短下肢装具の開発,"勝部 剛大, 斉 松, 伊丹 琢, 矢野 賢一, 森 一大, 亀田 和弘",生体医工学,Annual59,Abstract,537,2021
4439,空気圧ソフトアクチュエータを用いた足関節他動ROM訓練装置の提案,"岡本 宙, 大江 祥生, 谷口 浩成",生体医工学,Annual59,Abstract,536,2021
4440,術部の明るさ確保のための開創部装着型照明器具の基礎特性評価,"宮下 祐樹, 土井根 礼音, 楠田 佳緒, 月原 弘之, 正宗 賢, 土肥 健純, 桑名 健太",生体医工学,Annual59,Abstract,535,2021
4441,近赤外パルスレーザーを用いた低侵襲レーザー治療器開発：コラーゲン選択的加温による繊維芽細胞への影響,"川上 聡太, 小川 恵美悠, 伊藤 颯人, 熊谷 寛",生体医工学,Annual59,Abstract,534,2021
