No,Title,Author,Journal,Vol,No,Pages,Published_Year
1526,消化管内視鏡画像による診断支援ツールのための画像処理の研究,"柏木 航, 大河内 涼太, 薫森 亮輝, 廣田 優希, 安武 拓忠, 木戸 倫子, 横山 萌恵, 山田 憲嗣, 大野 ゆう子, 河合 真子, 吉田 成人, 長倉 俊明, 長倉 俊明",生体医工学,53,Supplement,S203_02,2015
1527,HSV表示内視鏡画像の色情報と分光画像による比較検討,"大河内 涼太, 柏木 航, 薫森 亮輝, 廣田 優希, 安武 拓忠, 木戸 倫子, 横山 萌恵, 山田 憲嗣, 大野 ゆう子, 河合 真子, 吉田 成人, 長倉 俊明",生体医工学,53,Supplement,S203_01,2015
1528,体腔内で体液を介在電解質として発電しながら計測、送信する発電カプセルテレメーターの開発,"松本 成史, 竹内 康人, 柿崎 秀宏",生体医工学,53,Supplement,S202_03,2015
1529,埋込型生体回路への電源供給を目的とした光エネルギーハーベスト技術に関する基礎的検討,"鈴木 康平, 京相 雅樹",生体医工学,53,Supplement,S202_02,2015
1530,ePTFE製肺動脈弁の挙動解析のための試験機設計,"武良 盛太郎, 白石 泰之, 坪子 侑佑, 三浦 英和, 山家 智之",生体医工学,53,Supplement,S202_01,2015
1531,高速動画像解析による補助循環時の末梢循環モデル化の試み：血液密度モデルを用いた基礎検討,"白石 泰之, 佐野 恭介, 北野 智哉, 三浦 英和, 佐々木 一益, 山家 智之",生体医工学,53,Supplement,S201_03,2015
1532,直接結合および静電結合による経皮的エネルギー伝送に関する基礎的研究,"斎藤 逸郎, 村上 遥, 阿部 裕輔",生体医工学,53,Supplement,S201_02,2015
1533,Fontan循環動物実験モデルによる小児用肺循環補助装置の評価,"山田 昭博, 白石 泰之, 三浦 英和, 坪子 侑佑, 平 恭紀, 佐野 恭介, 山岸 正明, 本間 大, 山家 智之",生体医工学,53,Supplement,S201_01,2015
1534,選択的腎動脈補助用カテーテル式補助循環装置の開発とin vitro評価,"住倉 博仁, 大沼 健太郎, 花田 繁, 築谷 朋典, 水野 敏秀, 本間 章彦, 向林 宏, 小嶋 孝一, 武輪 能明, 巽 英介",生体医工学,53,Supplement,S200_03,2015
1535,血液粘度が溶血指数に与える影響,"李 欣陽, 斎藤 逸郎, 圦本 晃海, 原 伸太郎, 阿部 裕輔",生体医工学,53,Supplement,S200_02,2015
1536,新しい肺血管抵抗モデル開発のための基礎検討,"坪子 侑佑, 渡辺 祥太, 白石 泰之, 三浦 英和, 山田 昭博, 鈴木 拓志, 平 恭紀, 山家 智之",生体医工学,53,Supplement,S200_01,2015
1537,チタンメッシュを用いた経皮情報伝送システム用組織誘導型電極の組織学的検討,"岡本 英治, 志田 茜, 三浦 英和, 白石 泰之, 山家 智之, 三田村 好矩",生体医工学,53,Supplement,S199_03,2015
1538,人工心臓制御のための迷走神経からの下行性信号抽出に関する基礎的検討,"松本 直樹, 深山 理, 原 伸太郎, 斎藤 逸郎, 磯山 隆, 阿部 裕輔, 満渕 邦彦",生体医工学,53,Supplement,S199_02,2015
1539,経皮的電力伝送システムにおける体内二次電池の新しい直接充電制御の研究,"三浦 英和, 山田 昭博, 白石 泰之, 山家 智之",生体医工学,53,Supplement,S199_01,2015
1540,完全人工心臓の為のフレキシブルTETS,"村上 遥, 斎藤 逸郎, 阿部 裕輔",生体医工学,53,Supplement,S198_03,2015
1541,全置換型人工心臓の駆動部のギャップ長の変化によるモータ特性の評価,"萩尾 勇樹, 三浦 英和, 白石 泰之, 志賀 卓弥, 山田 昭博, 坪子 侑佑, 佐野 恭介, 平 恭紀, 山家 智之",生体医工学,53,Supplement,S198_02,2015
1542,完全人工心臓時拍出量のMayer波成分帯域を自然心臓時Mayer波成分帯域に合わせる研究,"水田 宙, 斎藤 逸郎, 磯山 隆, 原 伸太郎, 圦本 晃海, 李 欣陽, 村上 遥, 満渕 邦彦, 阿部 裕輔",生体医工学,53,Supplement,S198_01,2015
1543,螺旋流ポンプの血液粘度推定に基づく圧流量推定,"圦本 晃海, 斎藤 逸郎, 磯山 隆, 原 伸太郎, 李 欣陽, 佐藤 雅巳, 村上 遥, 井上 雄介, 阿部 裕輔",生体医工学,53,Supplement,S197_03,2015
1544,シーケンシャルフローポンプにおけるインペラーの上下バランスの検討,"原 伸太郎, 磯山 隆, 斎藤 逸郎, 圦本 晃海, 前野 映里奈, 李 欣陽, 井上 雄介, 阿部 裕輔",生体医工学,53,Supplement,S197_02,2015
1545,シーケンシャルフローポンプのインペラーにおける流路数と形状,"前野 映里奈, 磯山 隆, 原 伸太郎, 斎藤 逸郎, 圦本 晃海, 李 欣陽, 井上 雄介, 熊谷 寛, 阿部 裕輔",生体医工学,53,Supplement,S197_01,2015
1546,モデル誤差を用いた補助人工心臓運用時の拍動推定と同期制御,"幡谷 原太, 田中 明, 吉澤 誠, 白石 泰之, 三浦 英和, 山家 智之",生体医工学,53,Supplement,S196_03,2015
1547,サポートベクタマシンを利用した補助人工心臓装着時の大動脈弁開閉動作の推定,"鷹箸 修平, 田中 明, 吉澤 誠, 白石 泰之, 三浦 英和, 山家 智之",生体医工学,53,Supplement,S196_02,2015
1548,体内埋め込み式人工心臓の解剖学的適合性に関する検討,"茂木 諒介, 本間 章彦, 住倉 博仁, 大沼 健太郎, 巽 英介, 福井 康裕",生体医工学,53,Supplement,S196_01,2015
1549,バブルリポソームの血流中誘導のための超音波照射の実験的検討,"和田 洸, 小井土 惇, 宮澤 慎也, 望月 剛, 桝田 晃司",生体医工学,53,Supplement,S195_03,2015
1550,ハイブリッド材料のための滅菌法の研究,"田代 彩夏, 井上 雄介, 磯山 隆, 斎藤 逸郎, 小野 俊哉, 佐藤 雅巳, 原 伸太郎, 圦本 晃海, 李 欣陽, 村上 遥, 川瀬 由季乃, 前野 映里奈, 熊谷 寛, 阿部 裕輔",生体医工学,53,Supplement,S195_02,2015
1551,医用材料の生体適合性評価指標開発を目的とした表面の水和状態に関する分子動力学シミュレーション,"植松 美幸, 蓜島 由二, 中岡 竜介, 中野 達也, 瀬川 勝智, 新見 伸吾",生体医工学,53,Supplement,S195_01,2015
1552,ハイブリッド材料を用いたタンパク除去フィルタの開発,"井上 雄介, 金子 明子, 関谷 毅, 染谷 隆夫, 関野 正樹",生体医工学,53,Supplement,S194_03,2015
1553,マイクロピラー基板を用いた細胞核の機械的拘束と細胞増殖性への影響,"長山 和亮, 村上 裕貴, 濱路 祐未, 佐藤 祐次, 松本 健郎",生体医工学,53,Supplement,S194_02,2015
1554,血管新生における細胞配置と増殖因子の濃度勾配による血管径への影響,"村居 良祐, 上森 寛元, 須藤 亮",生体医工学,53,Supplement,S194_01,2015
1555,ラット培養心筋細胞の脂肪酸組成に及ぼす多価不飽和脂肪酸添加培地の影響,"井口 聖也, 小坂 薫, 三輪 雛子, 佐藤 大介, 高橋 和昭, 馮 忠剛, 楠 正隆, 中村 孝夫",生体医工学,53,Supplement,S193_03,2015
1556,腫瘍微小循環における局所的な血管透過性の定量と可視化,"小田 慶太郎, 塚田 孝祐",生体医工学,53,Supplement,S193_02,2015
1557,繰返し引張刺激を負荷された血管内皮細胞におけるミトコンドリア動態,"塚本 哲, 新村 理, 竹村 考騎, 牛田 多加志, 多田 茂",生体医工学,53,Supplement,S193_01,2015
1558,抗体固定化マイクロ流路を用いた未分化iPS細胞の分離,"大高 晋之, 馬原 淳, 山岡 哲二",生体医工学,53,Supplement,S192_03,2015
1559,培養筋肉収縮運動抑制効果のグラヤノトキシン誘導体の種類による違い,"山木 湧登, アルムフティ バヤーン, 宇戸 禎仁",生体医工学,53,Supplement,S192_02,2015
1560,細胞の基板付着・伸展過程における焦点接着斑の形態変化の観察,"王 軍鋒, 杉田 修啓, 長山 和亮, 松本 健郎",生体医工学,53,Supplement,S192_01,2015
1561,交流磁場による培養筋肉の収縮制御,"伊賀 直輝, 宇戸 禎仁",生体医工学,53,Supplement,S191_03,2015
1562,培養骨格筋のバイオアクチュエータへの応用,"宮本 政典, 高田 陵平, 鳩間 翔平, 高木 空, 藤里 俊哉, 筒井 博司",生体医工学,53,Supplement,S191_02,2015
1563,網膜神経節細胞の確率論的特性のシミュレーション解析,"上坂 周平, 神山 斉己",生体医工学,53,Supplement,S191_01,2015
1564,解剖学に基づいた網膜視細胞モザイクの数理モデル,"斎藤 尚美, 神山 斉己",生体医工学,53,Supplement,S190_03,2015
1565,網膜錐体視細胞光応答のシミュレーション解析,"國貞 裕映, 神山 斉己",生体医工学,53,Supplement,S190_02,2015
1566,コイ眼盃標本における多局所網膜電位図,"針本 哲宏, 臼井 支朗",生体医工学,53,Supplement,S190_01,2015
1567,マイクロ培養デバイスによる髄鞘形成過程における神経活動伝搬評価,"酒井 洸児, 榛葉 健太, 小谷 潔, 神保 泰彦",生体医工学,53,Supplement,S189_03,2015
1568,テタヌス刺激後における神経活動マーカーc-fosの空間的評価,"田中 幸美, 磯村 拓哉, 榛葉 健太, 小谷 潔, 神保 泰彦",生体医工学,53,Supplement,S189_02,2015
1569,軸索における情報処理機能の評価に向けた微小培養デバイス,"榛葉 健太, 酒井 洸児, 小谷 潔, 神保 泰彦",生体医工学,53,Supplement,S189_01,2015
1570,大脳皮質の再現に向けたiPSC由来神経細胞の2次元培養パターニング,"飯田 尚子, 榛葉 健太, 田中 幸美, 酒井 洸児, 小谷 潔, 神保 泰彦",生体医工学,53,Supplement,S188_03,2015
1571,マウス脳グリア細胞の3次元形状に関する定量画像評価法,新タ 雅啓,生体医工学,53,Supplement,S188_02,2015
1572,微細加工技術を用いたマイクロ磁気刺激システムの構築,"大岩 孝輔, 榛葉 健太, 湯ノ口 万友, 小谷 潔, 神保 泰彦",生体医工学,53,Supplement,S188_01,2015
1573,生体磁場計測に向けた強磁性トンネル接合センサの作製とノイズ特性,"藤原 耕輔, 大兼 幹彦, 加藤 大樹, 城野 純一, 永沼 博, 桂田 弘之, 安藤 康夫",生体医工学,53,Supplement,S187_03,2015
1574,生体磁場センサ応用に向けた強磁性トンネル接合の作製と評価,"加藤 大樹, 大兼 幹彦, 藤原 耕輔, 城野 純一, 永沼 博, 桂田 弘之, 安藤 康夫",生体医工学,53,Supplement,S187_02,2015
1575,生体磁場センサ応用に向けたホイスラー合金電極 強磁性トンネル接合の作製,"小野 敦央, 大兼 幹彦, 永沼 博, 安藤 康夫",生体医工学,53,Supplement,S187_01,2015
1576,微小流体デバイスによるイオン濃度モニタの線形範囲の拡大,"和久田 暁彦, 山田 章",生体医工学,53,Supplement,S186_03,2015
1577,疾患早期発見用qRT-PCRポータブルデバイスの開発,"木村 雄亮, 池内 真志, 生田 幸士",生体医工学,53,Supplement,S186_02,2015
1578,移動マスク露光法による自己溶解型マイクロニードルの形成,"甲斐 貴久, 森 駿太, 加藤 暢宏",生体医工学,53,Supplement,S186_01,2015
1579,聴覚障がい者のための音源定位支援装置,"マコヴニコバ ヤナ, クグレ マウリシオ, 岩田 彰",生体医工学,53,Supplement,S185_03,2015
1580,環境音認識支援装置「サウンドウォッチャー」,"クグレ マウリシオ, トッサヴァイネン テーム, 中津 美紅, 岩田 彰",生体医工学,53,Supplement,S185_02,2015
1581,加速度センサを用いた体表面設置型嚥下センシング,"平 恭紀, 神谷 蔵人, 白石 泰之, 三浦 英和, 山田 昭博, 坪子 佑侑, 鈴木 拓志, 萩尾 勇樹, 武良 盛太郎, 渡辺 祥太, 本間 大",生体医工学,53,Supplement,S185_01,2015
1582,嚥下障害の診断精度向上のための数値シミュレータ(Swallow Vision)の開発,"道脇 幸博, 菊地 貴博, 神谷 哲, 外山 義雄, 長田 堯, 神野 暢子, 髙井 めぐみ, 羽生 圭吾",生体医工学,53,Supplement,S184_03,2015
1583,喉頭隆起と下顎骨の固定に着目した携帯型嚥下データロガーの開発,"安田 裕貴, 坂上 友介, 田中 昌博, 向井 憲夫, 覺道 昌樹, 牧川 方昭",生体医工学,53,Supplement,S184_02,2015
1584,脳卒中上肢リハビリテーションのためのロボット装具による到達把持運動の体幹運動計測,"坂井 伸朗, 林 克樹, 安部 汐美, 松村 悠暉, 涌野 広行, 山中 昌子, 松田 貴郁, 古場 友貴, 小野山 薫, 村上 輝夫",生体医工学,53,Supplement,S184_01,2015
1585,足こぎ車いす走行時の下肢の外転運動に関する評価,"石川 玲美, 杉田 典大, 阿部 誠, 吉澤 誠, 関 和則, 半田 康延",生体医工学,53,Supplement,S183_03,2015
1586,慣性センサを用いた歩行リハビリテーション支援のための評価指標算出・可視化アプリケーションの構築,"阿部 光司, 渡邉 高志",生体医工学,53,Supplement,S183_02,2015
1587,臨床応用を想定した直接給電FESの体内刺激装置実験に関する基礎的検討,"倉田 絵莉, 宮原 敏, 佐藤 文博, 松木 英敏, 加藤 健治, 鈴木 迪諒, 澤田 真寛, 西村 幸男",生体医工学,53,Supplement,S183_01,2015
1588,超低速度歩行のための角速度センサを用いた歩数計に関する基礎的研究,"関根 正樹, 田中 則子, 田村 俊世, 吉田 正樹",生体医工学,53,Supplement,S182_03,2015
1589,足圧分布における足趾領域の識別方法,"今泉 一哉, 岩上 優美",生体医工学,53,Supplement,S182_02,2015
1590,直線偏光近赤外線の高強度パルス照射が筋緊張に与える効果?脳血管障害患者による検討?,"竹内 伸行, 竹迫 信博, 下西 優子, 臼田 滋",生体医工学,53,Supplement,S182_01,2015
1591,EAMブレーキデバイスを用いた手袋型の指訓練装置の開発,"中村 尚人, 櫻井 宏治, 安齊 秀伸, 三井 和幸",生体医工学,53,Supplement,S181_03,2015
1592,仮想ライトタッチコンタクトに基づく歩行支援システム,"島 圭介, 島谷 康司",生体医工学,53,Supplement,S181_02,2015
1593,Kinectを用いたリアルタイム手話通訳システムの開発,"真田 慎, 岡田 志麻",生体医工学,53,Supplement,S181_01,2015
1594,重心位置と速度に着目した起立時の転倒リスク評価,"平井 秀雄, 岡 久雄",生体医工学,53,Supplement,S180_03,2015
1595,加速度センサ内蔵の食事介助用エプロンによる飲み込み検出,"都築 裕, 西谷 光世, 金 主賢, 中林 美奈子, 坪内 奈津子, 林 一枝, 中島 一樹",生体医工学,53,Supplement,S180_02,2015
1596,要介護者のベッド離床予測のためのベッド重心移動の位置-時間閾値に基づく姿勢変化の検出,"遠藤 嘉陽, 細川 聖, 齊藤 浩一",生体医工学,53,Supplement,S180_01,2015
1597,眼電図法による眼球変位角度を用いたアクセシビリティ機器,"大矢 哲也, 野本 洋平, 小山 裕徳, 川澄 正史",生体医工学,53,Supplement,S179_03,2015
1598,脳波によるメニュー選択の効率化に関する研究,"花房 昭彦, 関 祐人, 沢井 健太",生体医工学,53,Supplement,S179_02,2015
1599,容量結合による見えない電極を用いた完全無意識型浴槽心電図・呼吸計測システムの開発,"本井 幸介, 山越 康弘, 田中 直登, 山越 憲一",生体医工学,53,Supplement,S179_01,2015
1600,静電容量センサによるパンツ式オムツ外表面からのパッド尿吸収量評価,"紺野 秀士郎, 金 主賢, 中島 一樹",生体医工学,53,Supplement,S178_03,2015
1601,仰臥位と座位で排便時を想定し怒責した際の、生理的変化の違いについて,"今井 美香, 桑原 裕子, 平井 眞理, 西村 るみ子, 西村 直記, 清水 祐樹, 藤井 徹也, 岩瀬 敏",生体医工学,53,Supplement,S178_02,2015
1602,エアセルの低圧管理による体圧分散性の向上,"根本 哲也, 古田 勝経, 磯貝 善蔵",生体医工学,53,Supplement,S178_01,2015
1603,非接触電波センサを用いた 体動，呼吸計測による覚醒度推定に関する研究,"北川 将嗣, 岡田 志麻",生体医工学,53,Supplement,S177_03,2015
1604,輝度勾配ベクトルの畳込みを用いた起床動作の検出精度向上,"井上 円, 田口 亮, 服部 公央亮, 梅崎 太造",生体医工学,53,Supplement,S177_02,2015
1605,気圧センサによるベッド上の姿勢変化推定,"長井 聡, 福田 博也",生体医工学,53,Supplement,S177_01,2015
1606,光を用いた人体通信装置開発の試み,"関 大輔, 浪田 健, 加藤 祐次, 清水 孝一",生体医工学,53,Supplement,S176_03,2015
1607,リンク制御を用いた医療用光テレメトリについて,"戸谷 伸之, 高本 悠暉",生体医工学,53,Supplement,S176_02,2015
1608,保健医療福祉分野公開鍵基盤電子認証局の構築と運用,"山田 恒夫, 矢野 喜代子",生体医工学,53,Supplement,S176_01,2015
1609,臨床研究のための個人識別情報の非可視型連結可能手法について,"冨田 幸嗣, 北村 優汰, 毛利 公美, 中井 敏晴, 白石 善明",生体医工学,53,Supplement,S175_03,2015
1610,GISに基づく受療率変動を考慮した医療需要推計手法の検討,"土井 俊祐, 井出 博生, 藤田 伸輔, 高林 克日己",生体医工学,53,Supplement,S175_02,2015
1611,心臓植込み型デバイスの国内手術件数分析に基づく将来需要予測モデルの構築,"島谷 哲史, 渡邉 英一, 鈴木 康之, 野村 泰伸, 清野 健",生体医工学,53,Supplement,S175_01,2015
1612,多階層生体機能モデリングプラットフォームによるモルフォロジー・時系列データの統合,"浅井 義之, 安部 武志, 李 俐, 北野 宏明",生体医工学,53,Supplement,S174_03,2015
1613,網羅的遺伝情報の組み合わせ効果を取り入れたリスク診断モデル作成法に関する一考察,"鈴村 真矢, 中川 和也, 松井 孝太, 山田 芳司, 竹内 一郎",生体医工学,53,Supplement,S174_02,2015
1614,自己組織化ニューラルネットワークを用いたバイタルサインデータ解析によるインフルエンザの重症度判定,"孫 光鎬, 箱崎 幸也, 阿部 重人, 松井 岳巳",生体医工学,53,Supplement,S174_01,2015
1615,ビジョンベースARを用いた在宅健康管理システム用データ提示インターフェースの開発,小川 充洋,生体医工学,53,Supplement,S173_03,2015
1616,ストレス評価システムにおけるオノマトペの有用性,"青山 慎, 山岸 隼, 三宅 仁",生体医工学,53,Supplement,S173_02,2015
1617,ビッグ生体信号データ解析基盤システムの開発,"惠本 序珠亜, 平田 豊",生体医工学,53,Supplement,S173_01,2015
1618,スマートフォンにおけるキーストローク認証の基礎的検討,"石塚 亮, 島谷 祐一, 京相 雅樹",生体医工学,53,Supplement,S172_03,2015
1619,ドライビングシミュレータ操作情報とドライバの眠気との相関分析,"西尾 洋紀, 朴 昶熙, 河中 治樹, 小栗 宏次",生体医工学,53,Supplement,S172_02,2015
1620,ドライブレコーダの時系列情報を利用したドライバの眠気の高まり検知,"金子 祐来, 小田 賢, 河中 治樹, 小栗 宏次",生体医工学,53,Supplement,S172_01,2015
1621,ドライバの乗車前状態を用いた運転行動パターンの分類,"早田 有利, 柴田 千里, 入部 百合絵, 河中 治樹, 小栗 宏次",生体医工学,53,Supplement,S171_03,2015
1622,高齢ドライバの運転継続性評価に向けた経年変化モデルの提案,"藤澤 洋佑, 中野 泰彦, 河中 治樹, 小栗 宏次",生体医工学,53,Supplement,S171_02,2015
1623,交差点通過時における指差し呼称による安全確認が視線移動に与える影響,"岸 稚佳, 中野 泰彦, 河中 治樹, 小栗 宏次",生体医工学,53,Supplement,S171_01,2015
1624,長時間運転時における光刺激に対する反応時間の変化,"柴田 千里, 早田 有利, 入部 百合絵, 小栗 宏次",生体医工学,53,Supplement,S170_03,2015
1625,就寝時基底心拍数を考慮したドライバの眠気レベル推定,"森田 賢徳, 河中 治樹, 小栗 宏次",生体医工学,53,Supplement,S170_02,2015
1626,自動車ドライバの覚醒維持における能動的タスクの有効性評価：報酬と罰の効果と個人差,"近藤 勇気, 平田 豊",生体医工学,53,Supplement,S170_01,2015
1627,アレルギー対応の給食管理支援システムの開発,"早川 知道, 西川 智佳, 伊藤 孝行",生体医工学,53,Supplement,S169_03,2015
1628,離島災害医療のための航空・洋上医療連携と課題,篠原 一彦,生体医工学,53,Supplement,S169_02,2015
1629,非侵襲計測した自律神経系活動電位の解析方法の検討,"今川 雄暉, 岩瀬 敏, 西村 直記, 清水 裕樹, 植野 彰規",生体医工学,53,Supplement,S169_01,2015
1630,培養神経回路における神経雪崩現象と同期パターン相関,"矢田 祐一郎, 三田 毅, 眞田 章広, 神﨑 亮平, バッカム ダグラス, 高橋 宏知",生体医工学,53,Supplement,S168_03,2015
1631,三次元計測に基づく顔面神経麻痺の定量化に関する研究,"勝見 さち代, 服部 公央亮, 江崎 伸一, 村上 信五, 梅崎 太造",生体医工学,53,Supplement,S168_02,2015
1632,眼球運動中の網膜視細胞配列空間標本化映像の可視化シミュレーション,"小島 隆介, 平田 豊",生体医工学,53,Supplement,S168_01,2015
1633,眼球と身体の動きを検出するアイウェアの開発,"加納 慎一郎, 一戸 晋, 塩谷 俊介, 井上 一鷹, 川島 隆太",生体医工学,53,Supplement,S167_03,2015
1634,ヒトと魚における視運動性眼球運動の周期同調と眼球速度蓄積機構の関わり,"三木 俊太郎, 浦瀬 康平, ベイカー ロバート, 平田 豊",生体医工学,53,Supplement,S167_02,2015
1635,視覚刺激の輝度が運動学習に与える影響の評価-過重力下での運動学習促進効果との関係,"浦瀬 康平, 平田 豊",生体医工学,53,Supplement,S167_01,2015
1636,マイクロサッカード潜時解析に基づく音声および身体応答による認知負荷の客観的評価,"中井 裕真, 加納 悠史, 上田 慎一, 栗原 正幸, 岩崎 健二, 小濱 剛, 吉田 久",生体医工学,53,Supplement,S166_03,2015
1637,NIRS計測におけるタスク中の前額部皮膚血流変動分布,"伊藤 昭哉, 武藤 司, 藤井 麻美子",生体医工学,53,Supplement,S166_02,2015
1638,NIRS計測における線形逆問題法と深部信号選択フィルタの比較検討,"武藤 司, 伊藤 昭哉, 藤井 麻美子",生体医工学,53,Supplement,S166_01,2015
1639,NIRSを用いた嗜好に対する客観的評価の試み,"朝野 美穂, 南部 雅幸, 吉田 正樹, 川原 靖弘",生体医工学,53,Supplement,S165_03,2015
1640,高密度NIRS計測に基づく前額部機能的結合と皮膚血流相関の推定,"松木 翔也, 照井 智哉, 舟根 司, 木口 雅史, 田中 尚樹",生体医工学,53,Supplement,S165_02,2015
1641,近赤外分光法による脳血流計測に対する心臓血管動態の影響評価,"赤尾 旭彦, 牧野 類, 沼田 崇志, 松野 茂, 小川 雄太郎, 小谷 潔, 神保 泰彦",生体医工学,53,Supplement,S165_01,2015
1642,発達障害者の支援を目的としたNIRS-NFBシステムの開発とその評価,"中村 のぞみ, 栁澤 一機, 綱島 均, 成田 奈緒子",生体医工学,53,Supplement,S164_03,2015
1643,ニューラルネットワークを用いた小型NIRS-BCIシステムの開発,"下瀬 あかり, 奥村 壮太, 柳澤 一機, 綱島 均",生体医工学,53,Supplement,S164_02,2015
1644,NIRSを用いた視覚刺激呈示時の快・不快情動の評価,"栁澤 一機, 綱島 均",生体医工学,53,Supplement,S164_01,2015
1645,NIRSによる安静時機能的結合推定のための計測条件の検討,"岡本 亮太, 並河 弘樹, 小濱 剛, 吉田 久",生体医工学,53,Supplement,S163_03,2015
1646,NIRSを用いた脳機能計測における血液量変化の分離に関する一検討,"福田 恵子, 関原 謙介, 池田 彰, 岡田 裕貴",生体医工学,53,Supplement,S163_02,2015
1647,近赤外脳機能計測(fNIRS)におけるプローブ揺動の影響除去,"山田 亨, 梅山 伸二, 大橋 三男",生体医工学,53,Supplement,S163_01,2015
1648,時間分解スペクトロスコピーを用いた脳機能計測に関する研究,"村山 優太, 藤井 隆, 胡 莉珍, 宗像 忠夫, 薄井 英行, 酒谷 薫",生体医工学,53,Supplement,S162_03,2015
1649,大脳基底核のポジティビティ効果との関わり：言語処理における加齢変化,"木山 幸子, 國見 充展, 玉岡 賀津雄, リヌス フェアドンスコット, 中井 敏晴",生体医工学,53,Supplement,S162_02,2015
1650,fMRI/瞳孔反射同時計測パラダイムによる課題負荷の上昇に伴う生理的応答の変化に関する研究,"國見 充展, 松田 圭司, 木山 幸子, 高島 一郎, 中井 敏晴",生体医工学,53,Supplement,S162_01,2015
1651,認知処理切り替え機能を検査する臨床fMRIの開発 ?若年群と高齢群の比較?,"吉田 旭宏, 山本 遼, 小林 真介, 法山 智顕, 中井 敏晴, 國見 充展, 木山 幸子, 礒田 治夫",生体医工学,53,Supplement,S161_03,2015
